{
  "schema_version": 1,
  "id": "E3",
  "slug": "reference_systems_refund_service",
  "title": "Refund reference service",
  "description": "HTTP (+ optional Compose/Postgres) refund reference for connector doctor and differential probes.",
  "status": "contract-complete",
  "requires": {
    "python": ">=3.11",
    "envassure": "*",
    "extras": ["postgres"]
  },
  "entrypoints": {
    "run": "run.sh",
    "verify": "verify.sh"
  },
  "paths": {
    "input": "input",
    "expected": "expected"
  },
  "depends_on_integrations": ["reference-system", "http-connector"],
  "notes": [
    "Stdlib HTTP server is sufficient without Docker; compose requires ENVASURE_RUN_COMPOSE=1.",
    "Planted mismatch: observation balance 999 vs privileged 1000."
  ]
}
